Name,Type,Duration,Cooldown,Description,Prerequisites
Moderately Armored,Upgrade,,,You may use armor with a weight of up to 2,Lightly Armored
Heavily Armored,Upgrade,,,You may use armor with a weight up to 3. Your movement is decreased 1 space for every 3 armor. Cannot decrease movement below 1.,Moderately Armored
Incredible Strength,Upgrade,,,Your movement is only decreased 1 space for every 6 armor.,Heavily Armored
Immovable,"Advanced",,,"When using armor with a weight 3 or greater, all forced movement is reduced by 1 for every 3 weight.",Heavily Armored
Walking Tank,Upgrade,,,You can use armor of weight 4 or greater.,Heavily Armored
Digistruct Plating,Reaction,3,5,"As an action or reaction, you can digistruct armor plating. This action adds +2 to your current armor rating instantly. This bonus lasts for the duration of the skill.","Technomancy, Moderately Armored"
Shield Link,Basic,3,5,"When you are adjacent to an ally, you may use your action to link shields. Linked shields combine capacities, and operate at the higher deflect bonus. Shields operate at the lowest recharge rate.",
Shieldbending,Basic,3,5,"You may transfer a portion of your shield capacity to an adjacent shielded ally as a reaction. If you or the ally moves non adjacent, this skill enters cooldown",Shield Link
Shield Merge,Passive,,,"You may use 2 shields. Combine their capacities, choose the higher deflect bonus, and the lower recharge rate.",
Shield Overclocking,Passive,,,Shields you use gain +1 recharge.,
Shield Overload,Advanced,,,"You may overload your shields to make an attack against all adjacent creatures/objects. For every 2 shield capacity currently remaining in your shields, the attack recieves 2 accuracy and 1 damage. This attack depletes your shields immediately.",Shield Overclocking
Shield Hardening,Passive,,,Shields you use gain +1 deflect.,
Shield Syphon,Advanced,,,"When you hit with a melee attack, you may use Shield Syphon. Remove damage from the targets sheild as normal. For every 2 points depleted, add 1 point to your current shield capacity. This cannot cause your shield capacity to go above it's maximum. If this attack deals no health damage, even if damage points remain after the target's shield is depleted.",Shield Link
"Shield Node",Defining,3,5,"When you use this skill you gain your shielding cap (3) stacks of Shielding. Each Stack of shielding depletes BEFORE your standard shield capacity (allowing shield capacity greater than your maximum). As an action, you may shift a number of stacks of shielding from any adjacent ally to yourself, or any other adjacent ally. Targets without shield node cannot have more than their shield node cap (3 by default) stacks of Shielding at a time. ","Shield Link, Level 5"
"Shield TX Array",Upgrade,,,"When using Shield Node you may shift Shield stacks from yourself to any target within 5 spaces.",Shield Node
Shield RX Array,Upgrade,,,"When using Shield Node you may shift Shield stacks to yourself from any target within 5 spaces.",Shield Node
Shield Battery,Upgrade,,,Your shielding cap increases by 3.,Shield Node
"Shield Nexus","Upgrade",,,When using Shield Node you may move stacks directly between targets within 5 spaces. Your shielding cap increases by 3.,"Shield TX Array, Shield RX Array, Level 8"
"Shield Control Virus",Upgrade,,,"When using Shield Node, you may convert Shield Capacity into stacks of shielding when shifting. This does NOT trigger shield depletion effects if you reduce current capacity to zero, but does trigger recharge delay.","Shield Node, Level 5"
"Shield Coprocessor",Upgrade,,,"When using Shield Node, you may shift stacks twice per action.",Shield Node
Shield Watercooling,Upgrade,,,Shield Node's Duration increases to 6.,Shield Node